,Company,Location,Title,URL,Job Description
18,FROSMO,Helsinki,Technical Project Manager,https://avoimettyopaikat.monster.fi/technical-project-manager-helsinki-uusi-finland-frosmo/11/199797588,"Are you looking for a job that challenges you, motivates you, and allows you to become a better version of yourself every day? Then look no further! FROSMO is growing fast and is actively seeking talented people to join our international team.FROSMO is a Finnish software company based in Helsinki with further offices in Poland, Spain, the UK, and Sweden. FROSMO operates in the Digital Experience Management category and offers companies a fast and easy way to manage, design, and further develop the front-end of their digital services regardless of content management system, ecommerce platform, and marketing technology. With the Frosmo Platform, companies can adopt artificial intelligence models and bypass complicated deployment and data collection systems.To support FROSMOs continued success we are looking for aTechnical Project ManagerBased in Helsinki, you will have a pivotal role as the interface between customers and FROSMO teams, as well as offer technical support during the sales and customer support process.Youre passionate about technology and your excellent communication skills allow you to discuss complex concepts with developers and also present these ideas in a customer-friendly way. Sharing your knowledge and training customers and colleagues comes naturally to you. Running multiple projects simultaneously doesnt faze you and you enjoy analyzing data, identifying trends, and planning data-driven solutions.You might even have a background as a developer yet you enjoy working closely with customers.Responsibilities include:Scoping project deliverables and managing project plans to deliver on time, budget, and qualitySpecifying technical requirements, managing resources, and creating ticketsApplying agile methodologiesUsing analytics to provide business data and technical analysisTraining customers and colleaguesCreating and documenting test scripts and results, and acting as a testerWorking actively with customers and Customer Success Managers to ensure an accurate and achievable operational customer roadmapSupporting the sales teams during customer presentations and conducting software demonstrations where requiredThis is what were looking for in the ideal candidate:Minimum of3 years experience in project management, preferably with external clientsKnowledge of the ecommerce tech landscapeIn-depth knowledge of concepts such asA/B testing, personalization, and CROKnowledge of JavaScript, HTML, and CSS as well as of agile methodologiesGood understanding of best practices in software development and QAGoogle Analytics Individual Certificate or similarExperience with using a platform-based solutionExcellent communication and presentation skillsNative or bilingual proficiency in FinnishFull professional proficiency in EnglishAdditional desirable skills include:Project management certificationAgile certificationRelevant Bachelor or Masters degreeWe offer you an amazing opportunity to:Make an impact in a fast growing international technology companyBe a valued and crucial part of FROSMOs growth adventureCollaborate with super fun and talented colleagues in a friendly and caring atmosphereGrow as a professional within a culture that recognizes values such as: be yourself together, always aim higher, and learn, change and challengeIf this sounds like you and you want to join an expanding and exciting company on its journey to create great user experiences,apply as soon as possible!Well review applications as we receive them and interviews of potential candidates will begin right away. For more information contact HR Specialist, Rosita Wakkola: rosita.wakkola(at)frosmo.com. "
19,Vaisala,Helsinki,Website and Online Marketing Manager,https://avoimettyopaikat.monster.fi/website-online-marketing-manager-helsinki-uusi-finland-vaisala/11/200619513,"Location: HelsinkiWe are looking for: We are looking for a modern marketing expert to run our website, SEO, SEM and social programs. As a Website and Online Marketing Manager you are in a key role to help to achieve Vaisalas business objectives globally. As a member of the Online Team you coordinate with wide range of stakeholders, to ensure that the website provides content and functionality that meet the business needs of the organization. You ensure that website milestones and goals are met, according to approved budgets.Content strategy being in the heart of our online operations, your job is to develop Vaisala Industrial Measurement content based on business objectives. You oversee content requirements and conduct SEO, content and gap analyses. You are in charge of creating and maintaining promotional plans. In addition, you manage production projects, maintain budgets, and assist with the technical integration of content and optimize existing content pieces. You understand search engine marketing and social media advertising opportunities for B2B companies, and act as a center of excellence to the rest of team. As Website and Online Marketing Manager, you are a critical contributor to drive Vaisalas mission of enabling observations for better world.Your Key Responsibilities Include:	Develop and/or manage the updates of website content with relevant teams	Handle online marketing projects e.g. SEO, SEM and social media marketing	Consult and support Vaisala content production & content optimization	Develop strategies based on analytical data to improve campaign performance, the conversion rates and interaction of website content	Optimize other peoples content to be more conversion orientated and keyword targetedQualifications:To succeed in the position, you need to have deep understanding on website (Drupal) and online digital marketing in global B2B environment and strong analytical skills. In addition, you are a self-starter with excellent team work skills. Interested? Please contact Maiju Rauma (Head of Industrial Measurements Marketing) for more information, tel. +358 40 757 5930, on September 21 at 14  16 or September 28 at 8  10. Send in your online application with CV, cover letter and salary request by October 1, 2018. Be sure to send in your application soon! The position will be filled as soon as a suitable candidate has been found. . "
20,Management Events,Helsinki,"Management Trainee, Group Finance",https://avoimettyopaikat.monster.fi/management-trainee-group-finance-helsinki-uusi-finland-management-events/11/200497848,"Are you eager to join a Global Finance team and kick-start your career path in international Business to Business environment? Join our Management Trainee program, get great responsibilities from the day one - and learn more about our work & fun loving culture! The trainee program period is for 6 - 9 months, starting as soon as the right person is found. Location of work is ourHelsinki Headquarters.As a Management Trainee you get responsibilities starting from day one and learn by doing tasks as:Cash planning, payments and reportingFinancial monthly reporting, data collection and validationAnnual closing and reporting for entities and groupAudits and controlsSupporting business leaders in the decision making by measuring and analyzing business performanceCo-operation and communication with outsourced accounting, authorities and auditors around the worldWorking with the modern tools as: Business Intelligence & Analytics, CRM, Netsuite, Adaptive InsightsWe are able to give you demanding tasks and adjust your role according to your performance and capabilities. Our Group Finance team will give you the best support and coaching in your role.What's in it for you?Great work experience and working with the top managementTraining for your tasks and constant feedback and support to enhance your professional growthGreat career opportunities in our international organization - we are growing fast and want to commit the brightest talents to our responsibility positions!Compensation package consisting of base salary and a performance based rewarding modelYou may find a club of people like you: ambitious, positive, work and fun-loving. Check this video about our daily life:Working at Management Events?Succeeding in this position means that youAre eager to learn, ready to take challenges and willing to grow with usAre a team player with a positive can-do-attitudeHave strong analytical skills and an ability to 'see beyond the numbers'Have relevant studies, for example in the area of finance, business or economicsHave strong Microsoft Office Excel skills and keen to learn new softwareAre fluent both in Finnish and EnglishWe want to get to know you! Send us your application and CV in English.Click here to APPLY!For more information about the position, please contact:Viivi Reinikainen, Talent AcquisitionManager,+358 (0) 415052418Get to know us onFacebook! "
21,Deloitte,HELSINKI,Trainee (Human Capital Consulting),https://avoimettyopaikat.monster.fi/trainee-human-capital-consulting-helsinki-uusi-finland-deloitte/11/199847720,"We are now searching for a Trainee to join our Human Capital team in Helsinki, Ruoholahti.Trainee (Human Capital Consulting, Helsinki)You will work as an integral part of our team for a period of four months starting preferably in November. You can work either full-time or part-time, depending on your situation. Please tell us in your application about your situation and what would be suitable time for you to start.Whats in it for me?As a Trainee you will belong to one or more client engagement teams. The assignments may be related to, for example, business development processes, organizational transformation, or HR transformation. As part of engagement team, your tasks may include participating in data gathering and analysis and preparing client materials, among others. You will also get to assist in selling of these services.Our Human Capital practice deals with the people factors that affect an organizations performance. We partner with our clients to develop their organization, workforce and HR function. We leverage research, analytics, and industry insights to create business-driven talent, leadership, and change solutions. We are engaged in innovative projects that deliver genuine change that rely on the ability of our team to innovate.At Deloitte, you get to grow in a dynamic and multi-talented team. Together with skilled colleagues, we solve our customers diverse challenges. We support you in your career path and offer you possibilities to develop yourself. You get to join the Management Consulting Program, where you can develop your expertise by thorough orientation, trainings, and a wide range of customer engagements. You get to work with experts from various fields and to network with Deloittees in Finland and all over the world. For us, it is important to engage with our customers and each other.Can you see yourself at Deloitte?Are you passionate about business development? Do you have the desire to learn new things and ability to take action when needed? You will fit right in if you enjoy working in a team together with customers and easily see the big picture. To succeed in this role we hope you also have: a positive attitude towards team work and high motivation to perform	good analytical skills	an ability and interest in visualizing and presenting complex information in a clear and concise way	recently finished or almost finished master studies on relevant field (e.g Adult Education, Psychology, Business) with excellent grades	fluency in English and in Finnish, both written and oral	international experience is considered as an advantageHow to applyLet us get to know you by telling us about your skills and what motivates and drives you. Send us your application via our website by Sunday 23.9.2018. Please include your cover letter, resume and latest transcript of records. Also book Friday 5.10 and Monday 8.10 afternoons from your calendar for a possible interview at our office. We will send invitations to interviews via email so please follow your email carefully.For any inquiries concerning the position or Deloitte as an employer, Ida Siljander will be happy to help you. You can reach Ida on Monday 10th Sept at 14-15 or on Monday 17th Sept at 14-15, tel. +358(0)50 501 7101. For questions regarding the recruitment process, please contact our recruitment team at rekry@deloitte.fi The applications we would like to receive via our recruitment system. "
22,Envera Oy / co Mercuri Urval,Espoo,HEAD OF GROWTH HACKING,https://avoimettyopaikat.monster.fi/head-of-growth-hacking-espoo-uusi-finland-envera-oy-co-mercuri-urval/11/200249811,"HEAD OF GROWTH HACKINGDigital marketing guru - Join us and help Europe to save water!Envera is a fast growing SaaS company specializing for property energy management. Our solutions save European property owners' money, nerves and the nature. Join our versatile team to boost our growth in the international market!Responsibilities and tasks We have a great market-tested SaaS product and next we want to grow our client base in Europe. The challenge we are glad to hand over to the right person is to drive our demand generation and lead generation efforts in international context through digital marketing activities, in close co-operation with our international sales and product development. One of your main tasks will be to ramp up the number and quality of MQLs and SQLs. Our digital marketing  including everything from optimising our landing pages to marketing automation and social analytics to partner selections  is your territory. You should bring experience, strategic insight and execution capacity to us  we equip you with a product that is good both for the clients and the environment, and colleagues that want you to develop and thrive. Depending on your talent and preference, you can also have responsibilities on more traditional and creative areas of marketing  we look forward to hear what sort of role would be a perfect fit for you. Your skills We are looking for an analytically bright mind that is leaning solely on data and analysis when making decisions, instead of easy answers, own strong view or a gut feeling. The growth hacker of our dreams is ambitious and curious enough to always strive for better ways to drive conversion and seek out better alternatives for the current. We look for a person who has already delivered measurable results with a revenue-driving business impact in the area of digital marketing. You might have in-house and/or consulting experience, the most important thing is that youd like to commit to building something scalable for a few years. Wed love you to be a conceptual thinker with an eye for detail. As a leader you are able to get people to get the job done efficiently while enjoying it. You have strong ownership over your deliverables and a clear vision, but you are flexible enough to change course based on analysis and business needs. It goes without saying that you have a deep understanding of inbound marketing concepts and inbound marketing tools, such as HubSpot. Fluency in English is required, other languages are seen as an advantage. A university degree from a relevant field is preferred, but if you dont have it, please provide alternative evidence that you handle the core concepts of marketing and have the needed persistence and resilience to complete what youve started. What we offer You are being given an opportunity to shape up our way of doing digital marketing (and overall marketing, if thats what you burn for). Bringing our services to new countries and new segments will save energy and contribute to fighting upcoming water crisis. The more successful we are on our mission, the more professional growth opportunities youll have  wed like you to be a person that wants to grow together with our company and scalable enough as a person to change your perspective along the way. As the role has strategic importance, we provide competitive salary and other benefits, such as Monday breakfasts, gym benefit and company get-togethers. Most of all, youll have 100% support from all of our enthusiastic colleagues. Wed like this to be a massively successful next step in your career. We look forward to hearing from you We are working in collaboration with Mercuri Urval, specialists in Executive Search, Professional Recruitment and Talent Advisory. Please send your CV and cover letter through www.mercuriurval.com (ref.no. FI-13053) no later than Monday 24 September. For additional information please contact Hannu-Matias Nurmi, +46 70 815 5549 / hannu-matias.nurmi@mercuriurval.com or Anni Saarinen, +358 40 710 8656 / anni.saarinen@mercuriurval.comAbout Mercuri Urval Mercuri Urval is a leading global Executive Search, Professional Recruitment and Talent Advisory firm. We make sure organizations always have the right people capabilities in place so they deliver the best possible results. As pioneers in predicting the impact of peoples capabilities and personality on business results, we have always placed high importance on Executive Search and Professional Recruitment. Mercuri Urval was founded more than 50 years ago and works with more than 3.000 clients  across all sectors  in over 50 countries. Extraordinary results. Its all about people  www.mercuriurval.com "
23,Kesko Oyj,Helsinki,SAP BW Service Manager for K-Group,https://avoimettyopaikat.monster.fi/sap-bw-service-manager-for-k-group-helsinki-finland-kesko-oyj/11/199891579,"SAP BW Service Manager for K-GroupAre you enthusiastic about trade and new challenges and can you think digitally? Do you want to take part in creating unforgettable customer experiences? Join K Group and write your chapter in a European trading sector success story.K IT is looking for a Service Manager to work with K Groups business intelligence solutions as part of an energetic, change-driven crew. You will be learning from and contributing to a team of experts. Your specific area of responsibility will be developing and managing our SAP technology-based data warehousing and reporting applications in collaboration with internal stakeholders and IT vendors. At K Group, you get to be a part of the versatile and constantly changing world of trade.What we expect from you:hands-on experience with SAP Business Warehouse technology in roles such as IT specialist, service/development manager, consultant, architect, etc. SAP HANA knowledge is considered an asset.knowledge of IT service management, ITIL and agile development processescapability to engage with business stakeholders; to translate business requirements to IT specificationsfluent understanding of English language, fluency in Finnish is considered an assetcompetency to lead the work of IT vendors; to act a as project manager if neededA degree in computer science, information management or related subject is appreciated but not required.The trading sector is undergoing a major transformation, and thus offers an interesting working environment and opportunities for personal development.What we offer you:K Group offers the most attractive opportunities for driving forward the trading sector. Youll be working in a key function of a leading sector company and innovate solutions for its core operationsOpportunity to work with one of K Groups main assets where were continuously investing more and more in both technology and competences: dataThe support of an inspiring and professional work communityThe chance to constantly improve skills in a large international IT organization which offers several alternative career pathsModern and flexible working environment and culture with good employee benefitsThis is an excellent opportunity to get involved with large scale business intelligence and analytics projects promoting data-driven leadership in all of our operating countries and divisions. To succeed in your tasks you will get support from a great team of our experts and all the support, benefits and opportunities of a big global company.The position is located in Ruskeasuo, Helsinki. In 2019 we will relocate to one of the most modern workspaces in Finland as K Group moves its headquarters to the K Campus in Kalasatama, Helsinki.K Group is a strong and responsible operator in eight countries and we are constantly transforming and evolving. At K Group, you can build a career alongside top European trading sector professionals. We offer you interesting challenges and new perspectives every day. We take care of each other, our customers, the society and the environment.Lets make a good deal  join K Group.For more information, contact Juho Tahvanainen, tel. +358 40539 8104. Send your application by 16.9.2018 using the link below.-----------At K Group, you can build a career alongside 42,000 European trading sector experts. We operate in the grocery trade, the building and technical trade, and the car trade. Independent K-retailer entrepreneurs are the heart of our operation, and inspire the mission of the whole K Group to offer good food, make everyday life easier and make the world a better place. Through strong collaboration throughout the organisation, we are able to constantly exceed our customers expectations in stores, online and as a B2B partner. "
24,MPS,Helsinki,"Category Management Specialist / Paulig Coffee, Helsinki",https://avoimettyopaikat.monster.fi/category-management-specialist-paulig-coffee-helsinki-helsinki-uusi-finland-mps/11/200373764,"At Paulig, we are united in the quest of Exploring Great Taste. Paulig is a family-owned, international group in the food industry that is noted for its high-quality brands and services. The companys key areas are Paulig Coffee, Paulig Foods and Paulig Snacks. Our brands are Paulig, Santa Maria, Risenta, Gold&Green and Poco Loco. Paulig has 2.000 employees in 13 countries. Join us in Exploring Great Taste. www.pauliggroup.comPaulig Coffee is now looking for an ambitious and analyticalCategory Management Specialistto strengthen our Sales and Retail Marketing team located at Paulig Head Office in Helsinki. We are a dynamic, versatile and committed team driven by passion, dedication and reach for the best. Trade Marketing, Marketing Analyst and Field Sales are your main key stakeholders. You work as a tight back up and support for field sales in collecting and interpreting store level POS data, providing qualitative and quantitative analysis. You identify common areas of big bets as well as improvements regarding coffee category, campaign mechanics and shopper activations. You are responsible for facing and shelf space studies as well as planogram and merchandising guidelines.You love to be challenged and grasp the unknown with huge curiosity. You build your story on data-driven facts and you deal with customers with ease and effectiveness both internally and externally. Your ambition is to exceed the expectations and leave a footprint through your success cases. You get things done and have a hands-on approach and a project-based working style. To succeed in this role, at least a couple of years previous experience of FMCG industry and knowledge of retail POS data tools are mandatory. You might have had a position in retail sales support, market or category analysis, category or space management. You communicate fluently in Finnish and English.We offer you and interesting working field with possibility to develop and influence greatly. You have a chance to work with people from different interest groups and build productive partnerships. We have a passion for Exploring Great Taste and our values Strive for Excellence, Grow Together and Stay Curious shape strongly our everyday life at Paulig. For more information, please contact Head of Retail Marketing and Consumer Services Kati Kyllnen tel. +358 40 832 3863 on September 12th at 8.00-9.00 or on September 17th at 16.00-17.00. MPS Consultant Johanna Korte is available for further information on September 14th at 13.00-14.00 tel. 020 746 9455 and Johanna Leskinen on September 14th at 8.30-9.30 tel. 020 746 9406Please apply to this position with your CV and cover letter including a salary request in no later than September 20th 2018 via the application button below.Do you want to get to know us better? Go and have a look: @pauligfi, #munpaulig, #mypaulig, pauliggroup.comWhy is Paulig the best place to work: "
