,Company,Location,Title,URL,Job Description
12,Helvar Oy,Uusimaa,Software Engineer - Cloud Development,https://avoimettyopaikat.monster.fi/software-engineer-cloud-development-uusi-fi-helvar-oy/11/198832017,"Summer is here! And now is the perfect time to start a new week-day adventure. Do you have professional experience with cloud technologies? Are you interested in serverless architecture? If you are a high quality coder with the capacity and personality to take charge of a team down the road if needed, read on:Helvaris a 250-person innovative lighting solutions and components company (www.helvar.com) Headquartered in Finland with offices in both Espoo and outside London UK, we develop intelligent energy efficient products and solutions for global customers in 50 countries, fora variety of applications used inhospitals, schools, office buildings, crafted for the future of the SmartBuilding. Our products regularly win internationally recognized lighting awards. Inside our Agile organization, we are constantly developing newIoTsolutions with products ranging from our own hardware andsoftware encompassingembeddedproducts, mobile applications, developer APIs and cloud services.Over the last fewyearswe have gone through a digital renewal to foster our growth within product development andcloud-based systems, with an emphasis on digital, programmable and connected lighting control systems. We have since been developing advanced solutions including wireless, self-learning systems and sensor-based data services and analytics. Our wired and wireless lighting control systems will connect to the cloud; web user interfaces and apps will allow users to unleash the power ofHelvarsystems. Altogether, innovation is occurring around every corner from component development to our end-to-end systems.AsSoftware Engineer  Cloud Development, you will be part of a small team, working alongside similar professionals, reporting to the Finland Software Team Development Manager. Your main responsibility will be to develop software for our cloud-based platform. This platform enables our systems deployed globally to collect data from buildings which is then analyzed to provide insights such as occupancy rates, space utilization, and energy consumption to building owner and tenants. We also use the collected information for various machine learning and AI based algorithms which can predict malfunctioning devices and future occupancy predictions. Lots of cool stuff J.You will be responsible for the designing, coding, testing and documenting of our cloud software. We heavily use serverless architecture and managed services in our solutions and we would expect you to be somewhat familiar of such services provided by the major cloud providers. This work involves close co-operation with other staff and departments both in Finland and abroad.Requirements:Professional experience with (any)cloudservices, preferably AWSExperience with SQL and NoSQL Databases: Cloudhosted, managed databases such as DynamoDB, DocumentDB from Microsoft, RDS, AWS Aurora etcShould be familiar with RESTful APIsExperience in JavaScript/Node.JS development, C# or Java.Knowledge of network programming, wireless technologies & distributed systemsKnowledge of serverless architecture and microservicesExperience in agile and test-driven developmentPrior experience or knowledge of various AWS managed services or similar such as Lambda, SNS, SES, S3, API Gateway, Cognito etc.You are:An efficient coder with an understanding of algorithmic efficiency, data structures and object-oriented programming along with modern design patternsPassionate about delivering an outstanding experienceEager to learn and try new thingsSelf-driven & EasygoingA Career at Helvar gives you an opportunity to be part of the rapidly changing lighting industry. You will have wide responsibilities and various opportunities to influence research and development and to ensure our customers get the best product and service experience from us. At Helvar, we support you in your development as a professional. In our organization, an individual can really make a difference! "
13,Helvar Oy,Uusimaa,Software Test Engineer,https://avoimettyopaikat.monster.fi/software-test-engineer-uusi-fi-helvar-oy/11/198924007,"Summer is here! And now is the perfect time to start a new week-day adventure. Are you familiar with the Pytest framework, and Python development? Do you have experience testing software built on top of AWS services and serverless architecture?Helvaris a 250-person lighting solutions and components company (www.helvar.com). Headquartered in Finland with offices in both Espoo and outside London UK, we develop intelligent energy efficient products and solutions for global customers in 50 countries, fora variety of applications used inhospitals, schools, office buildings, crafted for the future of the SmartBuilding. Inside our Agile organization, we are constantly developing newIoTsolutions with products ranging from our own hardware andsoftware encompassingembeddedproducts, mobile applications, developer APIs and cloud services.Over the last few years we have gone through a digital renewal to foster our growth within product development and cloud-based systems, with an emphasis on digital, programmable and connected lighting control systems. We have since been developing advanced solutions including wireless, self-learning systems and sensor-based data services and analytics. Our wired and wireless lighting control systems will connect to the cloud; web user interfaces and apps will allow users to unleash the power of Helvar systems. Altogether, innovation is occurring around every corner from component development to our end-to-end systems.To strengthen our Product organization, we are now looking for a software test engineer to join our software feature team focusing currently on wireless solutions. The ideal candidate will be able to demonstrate a deep understanding of software testing and has experience in working closely with the developers.As Software Test Engineer, you will work closely together with developers, designers, product owners as well as DevOps. You understand testing life cycle and will create test plans, automate tests and execute manual tests where necessary. Your understanding of our products and solutions will help us improve the time-to-market by avoiding excess development rounds. Working with other testers on other teams to define common QA processes, you will make sure quality is built in to our products and services. You will be involved in the product creation process from start to the finish.Your experience will help us create operations which will make sure we release quality products. Team members have lots of room influencing and choosing tools and processes, since were building something brand new!ResponsibilitiesReview requirements, specifications and technical design documents to provide timely and meaningful feedbackCreate detailed, comprehensive and well-structured test plans and test casesEstimate, prioritize, plan and coordinate testing activitiesDesign, develop and execute automation scripts using open source toolsIdentify, record, document thoroughly and track bugsPerform thorough regression testing when bugs are resolvedPerform manual testing for non-automated test scenariosDevelop and apply testing processes for new and existing products to meet client needsTrack quality assurance metrics, like defect densities and open defect countsStay up-to-date with new testing tools and test strategiesRequirements:Professional experience in test planning and execution for web and mobile services as well as REST APIsExperience in writing clear, concise and comprehensive test plans and test casesExperience in executing automated and manual testsKnowledge on the available test automation tools and frameworks as well as the required scripting languagesExperience in agile and test-driven design, development and deploymentExperience in working closely with software developers and designersExperience in working with continuous integration toolsHands-on experience with both white box and black box testingRelevant academic degreeWe Appreciate:experience in testing software built on top of AWS services and serverless architectureFor Android: Mockito, Espresso, Junit, Robotium, or similarFor ReactJS: Jest, Mocha, Jasmine, Enzyme or similarAutomated test written in NodeJS and/or PythonYou are:An efficient software test engineer with understanding of customer needs and behaviorPassionate about delivering outstanding quality products together with the teamEager to learn and try new thingsGoal oriented and self-drivenEasygoingA Career at Helvar gives you an opportunity to be part of the rapidly changing lighting industry. You will have wide responsibilities and various opportunities to influence research and development and to ensure our customers get the best product and service experience from us. At Helvar, we support you in your development as a professional. In our organization, an individual can really make a difference! "
14,Patria,Espoo,"Data Mining -asiantuntija / Systems, Espoo",https://avoimettyopaikat.monster.fi/data-mining-asiantuntija-systems-espoo-espoo-uusi-finland-patria/11/199684770,"Patriassa puolustus-, turvallisuus- ja ilmailuteollisuuden monipuoliset tehtvt tyllistvt yhteens noin 2800 osaajaa. Esimiestyn ja osaamisen kehittminen ovat henkilstasioiden painopistealueita. Ainutlaatuinen huipputeknologian osaaminen ja vuosikymmenien kokemus ovat perustana tulevaisuuden menestyksekkisiin tuote- ja palvelukonsepteihin. Katso listietoja www.patria.fi Systems-liiketoiminta tarjoaa tiedustelu-, valvonta- ja johtamisjrjestelmi sek niiden elinkaaren tukipalveluita. Jrjestelmosaamisen ydint on tilannetietoisuuden kermiseen ja esittmiseen thtvien jrjestelmien toimittaminen. Toimipaikat ovat Tampere, Halli ja Espoo.Would you mine The Web? Onko mielestsi web-surffailu vain pinnan kosketusta? Haluaisitko sukeltaa syvemmlle? Etk pelk pimeit paikkoja kuten TOR? Etsimme uusia pioneereja tutkimus- ja tuotekehitystiimiimme, joka tyskentelee Internet-tiedusteluun liittyvien projektien parissa. Avainlyhenteit ovat mm. CW, IW, OSINT, CYBINT, CYBOPS, SOCMINT ja PSYOPS.Data Mining -asiantuntijaTytehtvien sislt kuvaavia ksitteit ja tykaluja ovat mm. Data Mining, Text Mining, Text Analysis, Data Profiling, Feature Extraction, Social Network Analysis, Predictive Analytics, Web Mining, Named-Entity Recognition, Hadoop, Cassandra, Scrapy, Solr, Lucene, Elasticsearch, Spark, Kafka, Scala, Python. Odotamme sinulta kiinnostusta yll kuvattuihin asioihin, intohimoa oppia jatkuvasti uutta ja omistautuneisuutta yhteiselle asiallemme, Suomen puolustamiselle. Voit olla aloittelija tai kokenut ammattilainen  roolisi tiimiss katsotaan kokemuksesi ja halujesi mukaan. Ymmrrmme hyvin, ett tyskentelytavat ja -ajat, joilla paras tehokkuus kustakin yksilst saavutetaan, vaihtelevat suuresti ja haluamme aidosti tukea sinua siin. Tiimimme on lhes kokonaan Espoon Otaniemess, mutta halutessasi typisteesi voi olla mys Tampereella tai Jmsn Hallissa. Jos alan opiskelut ovat viel kesken, mys osa-aikainen paikka voi olla mahdollinen.Miksi Patria? Patria on typaikka, jossa autat turvaamaan yhteiskuntaa. Meill tavalliset ihmiset ratkaisevat eptavallisia haasteita. Kun on kyse kriittisist operaatioista maalla, merell, ilmassa ja verkossa, osaamisella on merkityst. Laatu syntyy ihmisist  jokaisesta meist. Patriassa sin ratkaiset. Tarjoamme sinulle monipuolisia tehtvi projektien eri vaiheista erityislaatuisessa toimintaympristss. Saat hydynt osaamistasi ja oppia uutta mielenkiintoisten teknologioiden parissa kokeneiden ammattilaistemme ja osaavien esimiestemme tuella. Haluamme, ett viihdyt tysssi  tervetuloa meille! Alkoiko kiinnostaa? Ei muuta kuin hakemusta tyttmn.Listietoja tehtvst antaa Kaj Nyberg, p. 040869 3019, kaj.nyberg@patria.fiTyt hakemus 28.9.2018 menness. "
15,Danfoss Drives,Espoo,Digital Data Insight Specialist,https://avoimettyopaikat.monster.fi/digital-data-insight-specialist-espoo-uusi-finland-danfoss-drives/11/200506076,"Digital Data Insight SpecialistEspoo, Vantaa, Tampere (FI) or Copenhagen (DK)Job DescriptionWhat we offerDo you want to work for a global company and be a key player in the development of the digital customer experience in Danfoss Drives? Are you proactive, persistent and motivated by the opportunities to combine meaningfully digital technologies, data and business? Here it is your opportunity to join the Danfoss family. You can expect at least 20 days of travel per year, meeting colleagues from every angle of the world.As our new Digital Data Insight Specialist you will be part of the Global Marketing and Business Development function in Danfoss Drives. You will operate across different systems and databases, supporting our projects and operations. You should excel in the areas of research, investigation, data entry / manipulation, databases and should be passionate about transforming data into actionable insights.Main Purpose of the JobCreate a strong competitive advantage by leveraging data from different sources and turn them into meaningful insights for the business. You will play a crucial role in improving the customer experience across different digital touchpoints and support business growth targetsRole and tasks will includeLeverage data, get insights and drive/influence the organization into business decisionIdentify, analyze, and interpret trends or patterns in complex data sets from various sourcesMake recommendations for customer experience optimizationDevelop, manage and optimize databases on our productsDocument and present results, analysis and recommendations on a regular basisDevelop high quality monthly reports to monitor the effectiveness and business impact of our projectsWork cross functionally and with external partiesRequirementsBSc / MSc degree in Business, Statistics, Computer Science or relevant disciplinePrevious experience (at least 3 years) as insight data manager / data analyst in digital media agencies or eCommerce companies / functionsGood understanding of sales dataExperience in coordinating with various stakeholders in a matrix organizationStrong ability to read data, synthesize and generate insightsAbility to challenge internal and external stakeholder to improve resultsKnowledge of SQL, MySQL, BI and Google Analytics, CRMs (experience in SAP is a strong advantage)Other required skillsYou are fluent in communicating and presenting in both written and spoken EnglishYou are technically capable and process orientedYou are effective in task execution and meeting deadlines and goalsFor further information about this position, please contact Giuseppe Chiorazzo, Head of Digital Customer Experience, tel. +358 408371 985.For further information about the recruitment process, please contact Annukka Potka, Recruiter, tel. +358 40 8371 585.Please apply at your earliest convenience. We do not have an application deadline but accept applications as long as the job is posted.The position will be closed down once we have found the right candidate.Company ProfileWatch how Danfoss is Engineering tomorrow, here.Auto req ID14949BRType of PositionProfessionalJob AreaSales & MarketingCountry / CountriesDenmark, FinlandLocation / LocationsCopenhagen, Espoo, Tampere, VantaaExperienceMid-Senior LevelEmployment TypeFull-TimeSegmentDDS (Danfoss Drives Segment) "
16,Accenture,Helsinki,Junior SAS -developers,https://avoimettyopaikat.monster.fi/junior-sas-developers-helsinki-uusi-finland-accenture/11/200551358," Be yourself, Make a difference  Make a difference your way  Work where you're inspired to explore your passions, where your talents are nurtured and cultivated. Innovate with leading-edge technologies on some of the coolest projects you can imagine. And get the tools you need to keep learning and growing so you stay continually ahead of the game while making a difference in the world. Whatever you're passionate about, make the most of it in a career with Accenture. Whether you're a strategic thinker, a digital innovator, a tech wizard, or a business problem solver, you'll find an exciting career path on the cutting edge. We'd love to get to know your unique blend of talents and help you explore and grow them further. Accenture Digital Analytics is looking for Junior SAS -developers Accenture Digital is one of Accenture's five growth platforms and offers comprehensive portfolio of business and technology services across digitalMarketing, mobility and analytics. Analytics -practice at Accenture help our clients grow their business in new ways - by enabling them to achieve better performance through insights from data. Accenture works with organizations to develop analytic capabilities - from accessing and reporting on data to predictive modelling - to outperform the competition. Do you feel you could be our next piece of a puzzle and guide our clients to become truly data-driven companies and at the same time developing your expertise in data analytics? In the challenging but innovative crossroads of analytics and business, you would: Proactively propose new ways on how companies can leverage data for marketing and sales purposes Workshop with the clients to understand their needs and expectations and formulate those as data analysis problems Design and develop analytical solutions and statistical models to support data-based decision making Translate the results from data analysis or visualization into insight and communicate that back to our business stakeholders As part of our Analytics -practice you would join a worldwide network of smart and motivated colleagues with wide experience in leading statistical tools, methods and applications. You preferably have some of the following qualifications and interest to grow on the others: Previous experience on programmin SQL -knowledge Previous SAS -experience (preference on Base SAS) Good communication and presentation skills Ability to understand and interpret data from business perspective Ambition to constantly develop your skills and learn new Analytical mind-set Fluent Finnish (both oral and written) and Great team working skills Why Accenture? Because people enjoy working here - the work we do is challenging, interesting and meaningful. Accenture offers a unique career experience and unparalleled opportunity for you to grow and advance. We are driven by the best results but we never forget to support each other. We like to challenge our employees and give them the opportunity to shine and succeed. We invest heavily in our people's growth and knowledge development. Our best and only asset is our people. We believe they're at their best when knowing what's expected from them and we want to support them also in different life phases. Interested? Make your move - apply online and attach your cv, application letter and salary request in English. We look forward to meet you!  Accenture welcomes and encourages applications from diverse backgrounds related to gender, ethnicity, culture, age etc. We provide an environment of inclusion and diversity where everyone brings distinct experience, talent and culture to their work. We invite you to be part of this diversity. "
17,Dentsu Aegis Network Oy,Helsinki,Web Analyst,https://avoimettyopaikat.monster.fi/web-analyst-helsinki-uusi-finland-dentsu-aegis-network-oy/11/199633212,"Dentsu Data Services is part of Dentsu Aegis Network Finland, a global marketing communications group. In Finland, our group consists of media agencies Carat and Vizeum, creative digital agency Isobar, digital performance agency iProspect, out-of-home marketing agency Posterscope, programmatic buying agency Amnet, experiental marketing agency MKTG and content marketing agency John Brown Media. We are now looking for a Web Analyst to join our team!Web Analyst is a key role in the Dentsu Data Services (DDS) unit at Dentsu Aegis Network Finland delivering world-class marketing analytics services to the groups clients. DDS in Finland consists of a dozen experts on consumer research, marketing analytics and data science and is responsible for the development of local data services to our clients. Web Analysts are responsible for consulting and implementing analytics and marketing technology projects for our clients related to Google Analytics, tag management, Data Management Platforms (DMPs), data visualisation with tools such as Google Data Studio and providing continuous insights about clients (online) marketing performance.In addition to your colleagues here in Helsinki, Finland you have a peer group of hundreds of analytics and data experts worldwide with whom to share best practices and work on development initiatives. Role and Main ResponsibilitiesAct as a Web Analyst / Consultant for selected clientsDevelop our digital analytics offering together with the teamCoach, mentor and train other team members & internal stakeholders where neededAs an ideal candidate you possess a can-do attitude and the drive to get things done hands-onhave outstanding problem solving skillshave excellent communication skills  as a consultant you will need to be able to explain the world of analytics also to non-analytics-savvy stakeholdersknow your way around Google Analytics, tag management and data visualisation toolsbeen working on digital marketing and/or analytics already a few yearshave sufficient skills in web and tagging technologies needed to be successful in this position (Javascript, HTML, PHP..)Interest in developing your math and programming skills to be able to analyse large sets of datamay have a background in e.g. CRM, Marketing automation, SEO, SEM, Programmatic display or other digital marketing channels but youd like to focus more on web analytics in the futurehave experience other digital marketing / data platforms such as Adform, Doubleclick, MediaMath, Facebook, etc.Speak fluent Finnish and EnglishYou think you will enjoy working and develop professionally in an environment where:Youll have the freedom and responsibility to work on your clientsDepending on your areas of interest, youll be able to learn about consumer research, advanced analytics, machine learning and other fields of marketing analyticsYour teammates are experts from varied backgrounds with different skills: consumer research, web analytics, digital marketing, data scienceYou are encouraged to continually develop your skills for example by the means of internal training programmes, seminars, and online coursesYou are encouraged to cooperate with our international networkYou are encouraged to take responsibility and initiativeYou will be working with 200 people in Finland, and with over 60,000 globallyIf this sounds like you, please send your application and CV to rekry@dentsuaegis.com by September 16th 2018 with the subject Job Application  Web analyst. For more information contact Arto Hasu, Chief Data Officer, at +358 50534 2393. "
