,Company,Location,Title,URL,Job Description
0,Academic Work,Helsinki,"Osa-aikainen Data Scientist / Data Analyst, Houston Analytics",https://avoimettyopaikat.monster.fi/osa-aikainen-data-scientist-data-analyst-houston-analytics-helsinki-uusi-finland-academic-work/11/199503456,"Houston Analytics on tiedolla johtamisen ammattilaisten perustama analytiikkatalo, joka tarjoaa yrityksille kettern tavan hydynt dataa ja analytiikkaa ptksenteossa ja yritystoiminnan kehittmisess. Oletko sin se datavelho, joka haluaa oppia kaiken tiedon kermisest, datamallien luomisesta ja tiedolla johtamisesta?Tm positio tarjoaa hienon mahdollisuuden aloittaa tulevaisuuden urasi jo ennen valmistumistasi.KuvausAcademic Work etsii osa-aikaista data analystia Helsinkiin!Toimeksianto on osa henkilstvuokraustamme, jolloin tyllistyt Academic Workille, mutta tyskentelemn konsulttina Houston Analyticsill.TytehtvtTss tehtvss osallistut asiakasprojekteihin oman osaamisesi mukaan, projektipllikn pitess huolen kokonaisuudesta. Asiakkaat voivat olla eri toimialoilta, voit tysssi fokusoitua eri osa-alueisiin kuten IoT, kulutuskyttytyminen tai henkilst.Projektit lhtevt asiakkaan tarpeen mrittmisest, saatavilla olevan datan muokkaamisesta ja analysoinnista aina esittelyyn asti. Prosessit sisltvt erilaisia vaiheita datan integroinnista, mallien luontiin ja niden automatisointiin.Tytehtviisi kuuluu: Datan integrointi Dataan perustuvien mallien luominenHouston Analytics toimii tiiviin tiimin saavuttaakseen halutun lopputuloksen. Mikli olet joukkuepelaaja ja haluat tyskennell osaavassa ja ammattitaitoisessa yhteisss, paikka voi olla juuri sinun. Tehtvss sinulla on mahdollisuus kehitty ja edet yrityksen mukana haastavampiin eri toimialojen projekteihin.Etsimmme henkil onIdeaalihakijallamme on tehtvn soveltuva koulutustausta, esimerkiksi tilastotieteist tai matematiikasta. Lisksi sinulla on koulutuksen tai aiemman tykokemuksen kautta valmiudet datan ksittelyyn, analysointiin sek esittelemiseen. Sinulla tulisi olla kokemusta tietokantojen sek tiedonlouhintateknologioiden parissa tyskentelyst ja dataan perustuvien mallien luomisesta. Kommunikoit sujuvasti suomeksi ja englanniksi.Etsimllmme henkilll on: Tehtvn soveltuva koulutustausta, esimerkiksi tilastotieteist tai matematiikasta Osaamista yhdest tai useammasta tykalusta SPSS, SAS, R Tietokantaosaamista SQL, Hadoop/NoSQL Sujuva englannin ja suomen kielen taitoOhjelmointikielien, kuten Pythonin, Javan tai Scalan tuntemus katsotaan mys eduksi. Katsomme eduksi aiemman tykokemuksen vastaavista tehtvist!Lhet hakemuksesi mahdollisimman pian, sill aloitamme haastattelut heti soveltuvien henkiliden haettua paikkaa!Aloitus: Mahdollisimman pianTymr: Osa-aikainen, 35h/kk. Osaamisen karttuessa tymr voi kasvaa. Kesto: Mraikainen 12kk, jatko mahdollinenPaikka: HelsinkiPalkka: Sopimuksen mukaanJulkaisupivmr: 20.8.2018LISTIETOA HAKUPROSESSISTA Voit hakea tehtvn ainoastaan kotisivujemme kautta! Mikli rekisteridyt uutena hakijana sivuillemme, liitthn CV:si mukaan hakemukseesi erillisen tiedostona kohdassa ladattavat tiedostot. Rekisteridyttysi sivuillemme voit hakea typaikkaa painamalla Hae typaikkaa! typaikkailmoituksen alta. Mikli sinulla her kysymyksi hakuprosessiin liittyen, voit lhett shkpostia osoitteeseenhel02@academicwork.fi.Muistathan mainita typaikkakohtaisen id-numeron viestisssi. Huomaathan, ett emme ota shkpostilla vastaan hakemuksia. Kymme hakijoita jatkuvasti lpi ja saatamme kontaktoida uusia hakijoita nopeallakin aikataululla. Huomaathan, ett ilmoitus saattaa poistua sivuiltamme jo ennen viimeist hakupiv! Suosittelemme siis laittamaan hakemuksesi paikkaan niin pian kuin mahdollista. Ilmoituksen poistuttua sivuiltamme hakuprosessi on jo pttynyt tai olemme vastaanottaneet useampia potentiaalisia hakemuksia paikkaan, ja nin ollen edenneet hakuprosessissa.Academic Work on Home of the Young Professionals. Olemme erikoistuneet tyllistmn sek opiskelijoita, vastavalmistuneita ett uransa alkuvaiheessa olevia ammattilaisia. Voit tyskennell meidn kauttamme vuokrattuna konsulttina tietyss asiakastoimeksiannossa, tai tyllisty suoraan asiakasyritykseemme rekrytointiyhteistymme kautta. Lue lis osoitteessa www.academicwork.fi Infoa asiakkaastaHouston Analytics on tiedolla johtamisen ammattilaisten perustama analytiikkatalo, joka tarjoaa analyyseja liiketoiminnan ptksentekoon ja yritystoiminnan kehittmiseen. Mit helpompaa tiedon ja analyysien kytt on liiketoiminnan arjessa, sit laajemmin niit hydynnetn. Kysyttv? info@academicwork.fi, Ilmoitusnumero: 15011829 "
1,Nordea,Helsinki,Analytics Business Developer,https://avoimettyopaikat.monster.fi/analytics-business-developer-helsinki-uusi-finland-nordea/11/200318203,"Nordea Life Assurance Finland is looking for a business minded expert with a great deal of skill & enthusiasm for developing our analytics further.This is opportunity for you who are equipped with the can-do-it attitude. If you have the passion for showing how data and business intelligence can make a real difference for business decisions, continue reading.In todays world, change is the one thing you can count on. But whatever the future brings, our customers remain at the heart of everything we do. Thats where you come in. Working with dedicated colleagues in an exciting, fast-paced environment, youll help meet our customers changing needs.We aim to be courageous and explorative in our approach to innovating better ways of delivering banking services  anytime, anywhere. This means youll have many opportunities to learn and grow as you build your career with us. Will you help us lead the way in creating great customer experiences? The offerYoull join a Helsinki-based team called Digital, Process and Analytics Development which belongs to a Business Development unit within Nordea Life Assurance Finland. We work with digital development, customer experience development as well as process automation (RPA) and business analytics. You will work closely with process owners and other business developers as well as IT experts. Nordea Life is one of the Great Place to Work companies, so you will join a well appreciated work community. What youll be doing: Analysing, designing and implementing analytics in close cooperation with main business stakeholdersSupporting the use of self-service tools for analyticsPromoting the use of data in business decisions by bringing up ideas regarding what is possible analytics wiseParticipating in planning the future business landscape and roadmap for analyticsThe role is based in Vallila. Who are youCollaboration. Ownership. Passion. Courage. These are the four key values that guide us in being at our best. We imagine that you enjoy learning and are excited about bringing your ideas to the table. Youre dependable, willing to speak up  even when its difficult  and committed to empowering others.Your profile and background: A relevant university degree: a degree demonstrating a combination of business and IT understanding would be idealPassion for data and BI combined with a solid experience with SAS, SQL, QlikView, QlikSense or similar - preferably topped with some experience in advanced analytics and statistical mathematical methodsKnowledge of different databases and data sources and the ability to combine different data into meaningful analysisThe ability to use data for providing insights to different stakeholders, challenging existing business assumptions if neededExcellent communication and presentation skills in both Finnish and English including the ability to visualize and summarize your findings and propose clear actionsA convincing track record in finding pragmatic solutions and taking initiatives to their goalIf this sounds like you, get in touch! More informationAt nordea.com, you can read more about us, our business and our focus on integrating sustainability into everything we do.At Nordea, we recruit from the widest possible pool and hire the best person for the job. Because diversity makes us stronger. And once you are on board, you will find that we offer equal opportunities to everyone.Please submit your application no later than 20 September 2018.Great people often know great people  please share if you have a friend who could be a perfect match for this job.To all recruitment agencies: Please note, we dont accept unsolicited resumes for any of our positions. All contact regarding agency resumes should be directed to Nordea Talent Acquisition which handles everything related to recruitment. "
2,Accenture,Helsinki,Digital Analytics Consultants to Helsinki,https://avoimettyopaikat.monster.fi/digital-analytics-consultants-to-helsinki-helsinki-uusi-finland-accenture/11/200551352," We are looking for Digital Analytics Consultants to our Applied Intelligence -practice in Helsinki Accenture Digital is one of Accenture's five growth platforms and offers comprehensive portfolio of business and technology services across Digital marketing, eCommerce, Mobility services and Applied intelligence. Applied intelligence -practice at Accenture help our clients grow their business in new ways - by enabling them to achieve better performance through insights from data. Accenture works with organizations to develop analytic capabilities - from accessing and reporting on data to predictive modelling - to outperform the competition. We will give you the opportunity to grow personally and professionally in a dynamic environment. Our projects are built on cooperation and teamwork and you will find yourself working together with other talented, passionate and dedicated consultants, all working towards a shared goal.Do you feel you could be our next piece of a puzzle and guide our clients to become truly data-driven companies and at the same time developing your expertise in data and analytics?In the challenging but innovative crossroads of analytics and business, you would be: Proactively propose new ways on how companies can leverage data for different purposes Workshop with clients to understand their needs and expectations and formulate those as data analysis problems Design and develop analytical solutions to support data-driven decision making Translate the results from data analysis or visualization into insight and communicate that back to our business stakeholders We are currently looking for new talents on the fields of Data Visualization, Data warehousing, Data management, Data integration, and Supply Chain. We are looking forteam palyerswith the following qualifications: Master's Degree or PhD from a relevant field such as economics, math or information technology. Relevant previous experience from the areas mentioned above. We are also looking for recent graduates with excellenttrack record. Excellent technical skills and experience from different tools used in the Analytics space Ability to understand and interpret data from business perspective Above this we also want you to Enjoy working in diverse teams Have excellent written and oral/presentation skills in both Finnish and English Strong interest in growing your own functional, technology, industry, management, leadership and sales skills The position is based in Helsinki and may include travel.  Please note that due to the vacation period there may be delays in our recruitment process. Why Accenture? Because people enjoy working here; the work we do is challenging, interesting and meaningful. Accenture offers a unique career experience and unparalleled opportunity for you to grow and advance. We are driven by the best results but we never forget to support each other. We like to challenge our employees and give them the opportunity to shine and succeed. We invest heavily in our people's growth and knowledge development. Our best and only asset is our people. We believe they're at their best when knowing what's expected from them and we want to support them also in different life phases. Interested? Make your move - apply online and attach your CV, application letter and salary request in English. We look forward to meet you! Accenture welcomes and encourages applications from diverse backgrounds related to gender, age, ethnicity, culture, race, religion and belief, disability, nationality, sexual orientation and gender identity. Inclusion and diversity are fundamental to our culture and core values, providing an environment where everyone brings distinct experience, talent and culture to their work. We invite you to be part of this diversity! "
3,Stora Enso Oyj,Helsinki,"IT Development Manager, reporting and analytical applications",https://avoimettyopaikat.monster.fi/it-development-manager-reporting-analytical-applications-helsinki-uusi-finland-stora-enso-oyj/11/200197369,"IT Development Manager, reporting and analytical applications, Helsinki We are now looking for a motivated and experienced IT development manager, in reporting and analytics domain. Stora Enso IT provides IT solutions and services to all Stora Enso's divisions and group functions. We are nearly 400 employees in 18 countries. Reporting applications department consists of 24 highly skillful IT experts. We are maintaining and developing applications and platforms such as MS BI, Hyperion, SAS, SAP BW and CR360. Description The candidate will have two main responsibility areas. Firstly, the person will responsible supporting business to initiate reporting and analytics related IT developments. This means gathering various reporting needs with the business, turning those into high-level designs with associated costs, then prioritizing, coordinating, and following up the delivery with PMO and service teams. Secondly, the selected candidate is responsible for managing and ensuring that new developed IT applications and services implemented are properly supported and maintained by the corresponding IT service teams. This requires participation in the design phase as well as creating needed support and IT service governance processes and following-up the operations. Main responsibilities - Liaison with the business, perform requirement gathering, propose reporting solution high-level designs - Follow-up trends in reporting area, suggest operational improvements, plan life-cycle of existing solutions - Drive project initiatives, follow-up implementation and ensure successful hand-over to IT service - Ensure that reporting applications meet business and IT requirements; improve IT operational processes Qualifications The ideal candidate should have experience from the reporting domain, for example: - from managing reporting or analytical IT projects - from reporting or analytical solutions development or service operations - from financial, controlling or business analyst positions with an IT development emphasis It is also a plus, if you have experience from operating, implementing or using cloud based reporting or analytical solutions. To succeed in this position, you will need to have positive and proactive mindset and to be willing to work and liaison independently with the business stakeholders, but also communicating and coordinating initiatives together with various stakeholders inside IT. You should have - University or similar level studies in computer science, management information systems or other related area: e.g. statistics, accounting. - Excellent written and spoken English, ability to travel - Ability to work independently & also in a team, self-motivated and able to work under pressure IT expertise - Basic understanding or relational databases and IT infrastructure and IT service management - Knowledge of BI reporting tools and/or analytical tools and/or financial planning tools. - Knowledge of data warehousing and/or data lakes We offer you a challenging position as a part of motivated and skillful team of reporting experts. You will have the opportunity to contribute in development of world-class reporting solutions and join the transformation journey of Stora Enso IT. Please submit your application and CV by September 30th, 2018 at the latest. For more information, please contact: Head of Reporting Applications, Rami Lahti, rami.lahti@storaenso.com or +358 40 582 0182. Apply latest by 30.09.2018 on our site. Stora Enso Oyj 			Part of the bioeconomy, Stora Enso is a leading provider of renewable solutions in packaging, biomaterials, wooden constructions and paper globally. We believe that everything that is made from fossil-based materials today can be made from a tree tomorrow. Stora Enso has some 26 000 employees in over 30 countries. Our sales in 2017 were EUR 10 billion. Rekrytointia hoitaa Barona 			This recruitment is conducted in partnership with Barona. We are a bold expert on working life and a trusted partner in talent acquisition from start-ups to large corporations. We recruit approximately 12,500 professionals annually in various industries in Finland and internationally. "
4,Avaintec Oy,Helsinki,Chinese Speaking Junior Data Analyst,https://avoimettyopaikat.monster.fi/chinese-speaking-junior-data-analyst-helsinki-uusi-finland-avaintec-oy/11/199421491,"We are looking for a Junior Data Analyst who is self-motivated, well-organised, and an excellent analytic problem solver. This is a great opportunity to get involved in a dynamic and disruptive technology environment. The appropriate candidate has experience with big data processing mechanisms and tools, including for data storage (e.g. Hadoop, Spark), data governance of structured, unstructured and semi-structured data.As a Junior Data Analyst, your role will include analysing and validating data, creating digital conversion programs, doing quantitative and qualitative analysis and reporting. This position requires knowledge of Chinese culture, fluent written and oral English as well as Chinese.Key Responsibilities:Evaluate data qualityConduct analysis and communicate findings and insights to business unit leaders and/or clients on healthcare clinical outcomesInterprets results using a variety of techniques, ranging from simple data aggregation via statistical analysis to complex data miningConnect the data to the business processesConsulting with business customers about their requirementsData Mining, data mapping and process developmentIdentify issues related to data, data sources, and processingConduct relevant research, data analysis, and create reportsRequirements: Bachelors or Masters Degree in Computer Science or related discipline, or relevant work experienceProfessional written and verbal communication skills in Chinese and EnglishFamiliarity with data structures and algorithms, service oriented architectures, relational databases, data warehousing is desirableData-analysis-adjacent software skillsStrong SQL experience including knowledge of data relationships and structuresProven analytical skills with the ability to review complex data, draw conclusions and make recommendationsUnderstanding of large scale relational databasesKnowledge of Business Intelligence, Data Warehousing, Data Mining or Big Data with preferably a first experience trough school project, internship or first working experience.Excellent communication and interpersonal skills: you have the ability to communicate results clearly to both technical and non-technical colleaguesKeen to work with both customers and developersMind-set: Ability to work in a team, flexible, proactive, focus on objectives with high standard and qualitySelf-starter and a good team playerGood communication, analytical and problem-solving skillsAbility to function in a fast-paced environmentFeel comfortable working in a fast paced and changing environmentEnthusiastic about learning new thingsShould be able to take ownership and have strong client focusWillingness and capability to be mentored by senior architects, engineers and project managersWe offer you: A nice, relaxed atmosphere, competitive salary, meal benefit, and comprehensive health insuranceInteresting tasks with a variety of learning and development opportunitiesFinancially sound and internationally growing companyFlexible working hours and possibility to occasionally work remotelyCasual working atmosphere in modern office premises. Our working language is EnglishSupport of expert-level colleagues in a dynamic working atmosphereOur culture is built on respect, integrity and quality with low hierarchy. We value people who are fun to work with and who have a positive impact on everyone around them. This is a great opportunity to be a part of different strategical projects and work in an open environment where everyone can express their views and make a significant contribution. If you find this interesting, please submit your application along with your CV and salary request with subject Junior Data Analyst to jobs[at]avaintec.com no later than 28th of September 2018. For further inquiries, please contact People Operations Manager, Fatbardhe Hetemaj +358 44 553 4333. Note, well start interviewing interesting candidates immediately as applications drop in.Avaintec Oy combines 20 years of solid expertise in project business with a progressive startup mindset in a new global SaaS world. We deliver great user experience through service design, easy to use solutions and customer obsessed support. We worship agile product development, easy going atmosphere and big dreams. Our multinational Avaintec family (including over 10 nationalities) is mainly located in two offices: Helsinki (Finland) and Hangzhou (China)More information can be found on our web page www.avaintec.com "
5,Nordea,Helsinki,BI Specialist/ Data Analyst,https://avoimettyopaikat.monster.fi/bi-specialist-data-analyst-helsinki-uusi-finland-nordea/11/199947341,"We are looking for a Business Intelligent Specialist/ Data analyst to contribute in building our analytics capability and developing our analytics solutions and models. This is an opportunity for you to influence the future product and business development of Nordea Life.Machine learning, robotics, cloud computing. Were harnessing the power of technology to reinvent the future of banking. A digital revolution is underway  joining us puts you at the heart of it.Working with skilled, international teams in a fast-paced, agile environment, youll play a part in making us truly digital. We all have a role in building the best bank that serves our customers changing needs  through innovative solutions, collaboration and partnering with fintechs.Are you ready to embark on a learning journey where we lead the way and push the limits in transforming the future of banking? The offerYoull get the opportunity to join the peers of Nordea Life which has ranked well in Great Place to Work index (#13 at GPtW 2018). Due to our uniqueness and low hierarchy you can really influence on your way of work supported by inspiring environment where continuous learning and development is appreciated and success is celebrated. In Nordea Life IT unit, we work with modern technologies and tools in multi-national scrum teams. In this position, you will have a unique role in developing business intelligence and analytics solutions inspired by Nordea Lifes business goals and customer needs.What youll be doing: Providing capability to analyse and visualize data from different sources Proactively utilize data with existing tools and actively search new data sources Contribute in developing and improving our analytics tools and platform Work as an active member in the analytics team also challenging different stakeholders in order to build new processes and functionalities which serve the business needs During a typical working day you will interact with scrum team members both onsite and offshore The role is based in Helsinki. Welcome to a team where we share a passion for customer experience and insight. Who are youCollaboration. Ownership. Passion. Courage. These are the four key values that guide us in being at our best. We imagine that you enjoy learning and are excited about bringing your ideas to the table. Youre dependable, willing to speak up  even when its difficult  and committed to empowering others.Your profile and background:We expect that you understand databases and how analytical competences (data, tools and methods) can be developed. You have an ability to interpret business needs into analytics, bringing them together. You are familiar with customer analytics and online customer data and how they can be utilized and analyzed. You will show a strong passion to understand our business and you constantly develop yourself and you are eager to learn new things.Strong experience in data models and SQLPractical experience in working with data warehouses and different data sourcesPractical experience from QlikSense, Tableu or Alteryx is an advantageExperience with Python or R and Dimensional Modelling would also be considered as an advantageExperience or understanding of ETL-processes is considered as an advantageM.A degree in a data-driven field such as data science, computer science, statistics, or the natural sciencesFluent Finnish and English, both written and spokenIf this sounds like you, get in touch! More informationIn the Digital Hub at nordea.com, you can read more about us and how we are changing.At Nordea, we recruit from the widest possible pool and hire the best person for the job. Because diversity makes us stronger. And once you are on board, you will find that we offer equal opportunities to everyone.Please submit your application no later than 21 September 2018.Great people often know great people  please share if you have a friend who could be a perfect match for this job.To all recruitment agencies: Please note, we dont accept unsolicited resumes for any of our positions. All contact regarding agency resumes should be directed to Nordea Talent Acquisition which handles everything related to recruitment. "
