,Company,Location,Title,URL,Job Description
25,Operaria Oy,Helsinki,Unreal Engine Developer   Tr채 D  Helsinki,https://avoimettyopaikat.monster.fi/unreal-engine-developer--tr채-d--helsinki-helsinki-uusi-finland-operaria-oy/11/198307325,"Healthy livingWe at Trhus believe that everyone has the right to live in a healthy and safe environment. We want to change the way people design, build, buy and maintain houses. We create sustainable, healthy buildings and environments that last for generations.We are growing rapidly, and Tr D is now looking for a:Unreal Engine DeveloperThe first question that we often hear in Tr D is related to what digitality means when it comes to tradition and woodwork from where our roots stem.For us, digitalization, building materials or tools is not the absolute value, but - just like the rest of the Tr Group - the focus is on openness, healthy living and people's wellbeing.Digitality acts as a support to healthy living and is based on the ability to influence all aspects of construction. This path goes all the way from the architect's pen to the living room, sauna and office ending up to the service of the final building. Investigating this value chain and working towards a better outcome is at the heart of Tr D.Tr D's product development is wide-ranging, and technology seeks to solve the problems of traditional construction by improving the quality and ultimately the well-being of people - whether it is optimization or automation of production processes, collecting IoT sensor data or scalability of the cloud platform.Trhus has a long heritage of traditional construction, but at Tr D we are still at the beginning. It gives a lot of opportunities. However, we are backed by strong finances, experienced team and big partners who guide the business, providing enough freedom to implement things without the traditional burden on the technical side.Our office is located in the beautiful landscape of Kanavaranta in Helsinki. Our projects are located all over the world, just like our customers. Our business is also expanding all the time to cover a growing part of the digitalisation of the building industry. We are still small, but our boots are big and our direction is true. We feel that our values and visions are meaningful.With big boots, we also have big ears to listen to our employees and our customers. Learning is important to us, and we provide space for personal growth and leisure. People's well-being begins naturally from our own staff, which we are devoted to. Everyone's wellbeing is made up of different things and we want to hear how we can get you to enjoy yourself with us.What kind of people are we looking for?- Knowledge of the construction industry is not mandatory, but it certainly is helpful. The most important thing for us is that people feel our vision meaningful and want to help it forward.- We wish to have a deeper understanding of one or more of our technologies so that we can also find enough deep knowledge in each individual's own area and also have the opportunity to train more professionals around. Such expertise can be, for example, software development, cloud engineerinr or architecture, infrastructure engineer, service designer -or a combination of these.- For us, DevOps is important as a thought model. We feel that we are doing things together, and instead of throwing balls between teams - we want to make durable and high-quality things together. Agile methods are generally the basics of product development, but instead of focusing on processes, our spotlight is on the outcome.- Courage and open-mindedness are needed - especially in the construction industry! We don't want to do things as before if they can be done better, and we are not afraid to question things. By running agile prototypes, we can show how things work and gather data to support or against the claims.- If analytics, Big Data, and the different degrees of machine learning are close to your heart, but you would like the outcome to be something more than flooding targeted mobile ads to people, this could be your chance! For us, this means things as better-functioning buildings with healthy indoor air where the material choices, durability, and usage are on a sustainable basis.Tr-D is part of TrGroup - Read more of our mission fromhttp://tragroup.fi#devops #construction #prototyping #welovetr "
26,MOIA Finland Oy,Espoo,Software Engineer (m/f),https://avoimettyopaikat.monster.fi/software-engineer-m-f-espoo-uusi-finland-moia-finland-oy/11/199139232,"We want to hire Software Engineers to contribute to the processing of street data, development of bleeding edge routing algorithms and software for our mobility services that will change our everyday lives.MOIA is an innovative mobility company that will change peoples lives by re-imagining urban mobility. MOIA will create services that enable more people to move more freely and securely, ultimately making cities better places to live. We will free up the movement of people and goods within cities whilst making mobility accessible to everyone. That means we will: Make city traffic clean, safe and silentCreate more time and space for peopleBring affordable and convenient mobility to everybodyWe would be delighted if you were to accompany us on this exciting and challenging journey. We are not only looking for candidates to fill our job vacancies; we want you as a crucial part of our team. Our core competence is passion.What you will doYou will develop software for MOIA Pooling Engine as a part of the team of highly motivated professionals in Espoo. We have two tracks for Software Engineers so that you can select the one fitting best to your skillset. Both tracks have in common thatThe software you develop will use cutting edge cloud technologies for rapid deployment and scalabilityYou design, develop, deploy and operate important software solutions that your peers praise for its elegance and code readabilityYou will be part of the team that will work like a startup and take ownership for the whole development cycle - from ideation over design to implementation and maintenanceThis will require you to be ambitious, in delivering products that re-define the customer experience and making bold decisions about the means and tools of delivery and operationWhat we expectOur ideal candidate has an applicable education and enthusiastic attitude towards delivering high quality software and keeping up with current trends in software design. You can be a seasoned veteran or in early steps of your career as long as you have the right background and hunger to learn more. We value highly strong problem-solving skills and analytical thinking. Effective communication skills including fluent communication in English are expected.In the routing track, we would expect you to have experience in all or some of the following:Experience with Python, (Cython, C/C++) and/or JavaMSc in computer science or equivalent education2-5 years of relevant work experienceStrong interest and knowledge of complex algorithmsPrevious experience with geographic data, databases and software is seen as an advantageIn the Scala track, we would expect you to have experience in all or some of the following:2+ years experience in a JVM language and a strong interest in Scala Experience in the following is a plus; Docker, Akka, databasesExperience with building and/or running large-scale applications on a PaaS/SaaS cloudsContinuous deploymentAgile methodsWhat we offer youWe are a new company and a fast-growing team. We see things from a people perspective, observing, learning and responding to their social needs. We are always curious to find better ways to do things and so we question everything. We are driven by the possibilities better urban mobility solutions can unlock. We work with different people, disciplines and companies to make great things happen. MOIA offers a unique opportunity as it combines the best of the startup and corporate worlds. We are an innovative new business based in top locations such as Berlin and Hamburg, but are also backed by a large corporate parent providing funding, resources, know-how and commitment.Our work is dedicated to transforming the lives of billions  you will be part of this vision "
27,Danfoss Drives,Espoo,Digital Lead,https://avoimettyopaikat.monster.fi/digital-lead-espoo-uusi-finland-danfoss-drives/11/200505624,"Digital LeadEspoo, Vantaa, Vaasa, Tampere (FI) or Copenhagen (DK)Job DescriptionWhat we offerYou will have a great opportunity to join the Danfoss family and work in the Digital Customer Experience team at Danfoss Drives.Your primary goals will be to identify projects and opportunities for growth and digital innovative solutions. You will be translating the innovation ideation into working prototypes and bring them to market.Role and tasks will includeContribute to the digital transformation roadmap as part of the Digital Customer Experience team at Danfoss DrivesIdentify opportunities for business growth by experimenting with technology trends and by evaluating trending disruptive technology patternsLead digital differentiator projects and formulates annual operational and financial budgetsBuild and assess business cases for new digital projectsIdentify and build an ecosystem of partners within the education, startups and vendors scenesEstablish a continuous learning culture and strive for a data driven mindset changeManaging digital projects in close co-operation with IT and selected vendorsEducation and work experience requirementsAcademic background in Business/ Design/ Innovation/ Engineering/ Digital/Computer Science/ Statistics or relevant disciplinesExperience in software development and proven history managing and delivering complex projects (e.g. AI, machine learning, mobile devices, cloud computing, big data analytics)Strong background in technology, analysis and critical evaluation of information gathered from multiple sourcesDeep experience with modern toolsets in Agile environments and development methods, e.g. user-centered designProven experience in successfully working in a team setting and ability to reconcile conflicts.Essential personal characteristicsDriven and resilient. You will deal with changes and these lead to resistances.Organized and goal oriented. You can plan, organize and carry out projects, keeping an eye on time, personnel and financial resources. Your contribution is measured by the sum of invention and market successEloquent and fluent communicator. You can speak the language of various departments, of our customers and partners.Curious and challenging. You are a trend spotter. You have experience in successfully working in cross functional and diverse teams and possess the ability to reconcile conflicts.For further information about this position, please contact Giuseppe Chiorazzo, Head of Digital Customer Experience, tel. +358 40 8371 985.For further information about the recruitment process, please contact Annukka Potka, Recruiter, tel. +358 40 8371 585.Please apply at your earliest convenience. We do not have an application deadline but accept applications as long as the job is posted.The position will be closed down once we have found the right candidate.Company ProfileWatch how Danfoss is Engineering tomorrow, here.Auto req ID14948BRType of PositionProfessionalJob AreaSales & MarketingCountry / CountriesDenmark, FinlandLocation / LocationsCopenhagen, Espoo, Tampere, Vaasa, VantaaExperienceMid-Senior LevelEmployment TypeFull-TimeSegmentDDS (Danfoss Drives Segment) "
28,CSC - Tieteen tietotekniikan keskus Oy,Espoo,System Specialist,https://avoimettyopaikat.monster.fi/system-specialist-espoo-uusi-finland-csc-tieteen-tietotekniikan-keskus-oy/11/199633300,"We are looking for enthusiastic system specialists to strengthen our team at CSC and support growth of the company. The team you will be working in will focus on developing the next generation data ecosystem for HPC, Cloud and Data analytics. The team is responsible for upcoming data lake installation and deployment project. After the deployment, teams main responsibilities will be administration, operations, maintenance and development of CSC new storage ecosystem including data lake, cloud storage (ceph), data movers and interoperability with Cloud and HPC systems.Prospective candidates are expected to have a strong background in one or more of the following and a strong interest in willing to develop their skills in all of these areas:  Advanced Unix/Linux systems administration skills Administration and monitoring large scalable systems Information security and data integrity  Storage technologies and file systems LAN and SAN networks Team working and communicationsExperience on following tools, methods and technologies will be considered an advantage: Agile development practices: Scrum, Kanban, DevOps CI workflows and tools: Ansible, Puppet, Jenkins, Git Software defined storage and distributed file systems (Ceph, Lustre, Gluster, GPFS) Programming and scripting: Python, bash, perl  Development in cloud environment using REST APIs e.g. S3 Data management, metadata handling, tiered storage and data movers Cloud and container technologies: OpenStack and DockerBuilding new competencies and selecting right tools and technologies will be important part of the teams responsibilities. In case you have some of the skills and competencies required and you are willing to learn new skills you could be the right person for the position.A university degree or equivalent experience is expected. The position can be in Espoo or Kajaani.For more information, please contact recruiting manager Samuli Saarinen, samuli.saarinen(at)csc.fi. .Please send your application by 21st of September 2018 through our recruitment pages on our website www.csc.fi/jobs. CSC  IT Center for Science is a non-profit state enterprise with special tasks. It is owned by the Finnish government and higher education institutions. We develop and offer high-quality ICT services for research, education, culture, public administration and companies to enhance our customers success and ultimately benefit the whole society.The accomplished staff forms the grounds for our success. We offer interesting tasks in an encouraging atmosphere, and the opportunity to develop your own expertise in an international company that has long traditions. At CSC, your colleagues are friendly, enthusiastic and curious top-notch experts in their field.CSC  Jobs for Brilliant Minds "
29,aTalent Recruiting,Espoo,Medaffcon: Junior Bioinformatician,https://avoimettyopaikat.monster.fi/medaffcon-junior-bioinformatician-espoo-uusi-finland-atalent-recruiting/11/199951651,"Recommended year of studies: End of studies  some working experienceWorking time: Full-timeLength: PermanentLocation: Tietjntie 2, EspooRequested starting date: As soon as possible, negotiableDL for applications: 16.9.Medaffcon Oy is an Espoo, Finland, based Medical Affairs and Market Access consulting company. As of August2018 Medaffcons personnel consists of 25 full-time employees.Medaffcons core competence is a combination of wide top-notch expertise and practical know-how. The quality of our services is based on our strong medical, scientific, industrial and health economic knowledge and experience, outstanding process and project management and our wide-ranging cooperation network. We at Medaffcon dive into our clients challenges and customise practical solutions for them. We believe in the power of interaction.Our vision is to act as a selected strategic partner for different types of health economic and scientific projects in Finland and abroad. With our constant personal growth and development, we provide our customers with new significant perspectives and solutions.Medaffcon is looking for a Junior Bioinformatician to analyze real world data. You get to familiarize yourself with Big data, data processing and data analyzes. Youll be a part of Medaffcons professional team. Your task is to analyze clinical and genetic patient data as part of various research projects. To succeed in this position, you should have some knowledge of data processing, data analyzes, research and statistical planning and reporting. Our aim is to find solutions and bring added value to our customers.We are looking for a highly motivated person who is able to quickly learn and adopt new things. We hope you have a curios mindset, good stress tolerance and ability to multitask. We provide training in our procedures and processes. The position is fulltime, but if you are at the end of your studies, the working hours are negotiable. We offer you an excellent learning and growth opportunity in a non-hierarchical and creative team environment.In a nutshell  we look for:Relevant educational background (e.g. Statistics, Science, engineering or equivalent)Knowledge in statistics & skills to apply statistical models to practice, we prefer knowledge on R, however you are free to use the tools of your preferenceDatabase skills e.g. in SQL or other relevantSelf-directed analytical working style, strong teamworking skills, ability to solve problems and interest towards healthcarFluency in English  our reporting language is English, Finnish skills are seen as an advantageWhat Medaffcon can offer you:A chance to participate in client projects from day oneA key role and a permanent position in a rapidly expanding health tech companyThe support of an experienced and versatile teamA possibility to develop your professional skills and build up a relevant work experience with unique projectsExperience of working with similar tasks is naturally a benefit but more importantly, we are looking for the right type of naturally curious person that enjoys solving complex challenges and taking ownership of their work.If youre the Junior Bioinformatician were looking for, send your CV and application letter (preferably in PDF-form) by the latest on the 16th of September here: https://apply.atalent.fi/medaffcon-junior-bioinformatician-8-2018 Please mention your earliest possible starting date and salary request. You can read more about Medaffcon atwww.medaffcon.fi/. For information on the application process, please contact Recruitment Manager Ccil Fagerstrm (cecil.fagerstrom[at]atalent.fi, 050 505 3170). "
30,Accenture,Helsinki,SAP Logistics Consultant,https://avoimettyopaikat.monster.fi/sap-logistics-consultant-helsinki-uusi-finland-accenture/11/199717673," Are you Accenture's future SAP Logistics talent?  Join Accenture and help transform leading organizations and communities around the world. The sheer scale of our capabilities and client engagements and the way we collaborate, operate and deliver value provides an unparalleled opportunity to grow and advance. Choose Accenture, and make delivering innovative work part of your extraordinary career.  We will give you the opportunity to grow personally and professionally in a dynamic environment. Our projects are built on cooperation and teamwork and you will find yourself working together with other talented and dedicated professionals, all working towards a shared goal. As SAP Logistics Consultant, you will be working in providing application services, including solution design, configuration, testing and deployment activities at our clients. You have experience with SAP Supply Chain Management aspects across the inbound logistics, manufacturing, and outbound logistics processes. You have been in roles as trusted advisor for clients with ability to advocate for leading practices in subject matter, which is key for our client's success in being high performers. Qualifications: Documented SAP Supply Chain Execution experience with one or more of the following processes: Procurement, Manufacturing, Warehousing, Order fulfillment, Shipping and Transportation Hands-on experience with Supply Chain configuration, and process standardization/optimization SAP Certification will be an advantage SAP S/4HANA experiencewill bean advantage Able to assess current state, identify customer requirements, and define the future state and/or business solution Solid understanding of the customization and able to provide guidance to technical teams, and manage the solution delivery Experience in reviewing functional and technical designs Capable of planning and executing tests including generating test data and scripts Documented project experience in at least one full-project lifecycle Personal skills: You have excellent communication (written and oral) and interpersonal skills both in Finnish and in English You have excellent stakeholder management skills You have the ability to work creatively and analytically in a problem-solving environment Our employees are our most important asset. At Accenture, we believe that quality comes from within and we invest heavily in developing your professional competencies. You will receive on-going training that builds and extends your skills on a continuous basis, allowing you to develop tailored expertise quickly. You will have direct access to state-of-the-art technologies, tools and developer kits from all the major hardware and software houses, keeping you on cutting-edge of your area of expertise. Interested? Make your move - apply online and attach a CV and a letter of application in English. We look forward to receiving your application!  If you have any questions concerning or our recruitment process, please contact finland.recruitment@accenture.com. Note that we are interviewing candidates already during the application period!  Accenture welcomes and encourages applications from diverse backgrounds related to gender, age, ethnicity, culture, race, religion and belief, disability, nationality, sexual orientation and gender identity. Inclusion and diversity are fundamental to our culture and core values, providing an environment where everyone brings distinct experience, talent and culture to their work. We invite you to be part of this diversity "
31,Accenture,Helsinki,SAP Finance Consultant,https://avoimettyopaikat.monster.fi/sap-finance-consultant-helsinki-uusi-finland-accenture/11/199717672," Are you Accenture's new SAP Finance Consultant?  Join Accenture and help transform leading organizations and communities around the world. The sheer scale of our capabilities and client engagements and the way we collaborate, operate and deliver value provides an unparalleled opportunity to grow and advance. Choose Accenture, and make delivering innovative work part of your extraordinary career.  We will give you the opportunity to grow personally and professionally in a dynamic environment. Our projects are built on cooperation and teamwork and you will find yourself working together with other talented and dedicated professionals, all working towards a shared goal. SAP Finance professionals design, implement and deploy SAP solutions to achieve defined business goals. Maintain skills in SAP applications process design and configuration; SAP application design, development, integration, testing and deployment; and SAP application technical architecture. Qualifications: Documented SAP Finance experience SAP S/4HANA experiencewill bean advantage SAP Certification will be an advantage Capable of assessing current state, identify customer requirements, and define the future state and/or business solution. Experienced with analyzing the finance processes in an organization and design its processes and systems based on processes and functionality. Plan and execute performance related tests as needed and should able to generate test data for various regression and formal test scenarios Documented project experience in at least one full-project lifecycle Proven ability to assess the business model and its integration with technology Experience in creating functional designs Research, gather and synthesize information Ability to travel Personal skills: You have excellent communication (written and oral) and interpersonal skills both in Finnish and in English You have excellent stakeholder management skills You have the ability to work creatively and analytically in a problem-solving environment Our employees are our most important asset. At Accenture, we believe that quality comes from within and we invest heavily in developing your professional competencies.  You will receive on-going training that builds and extends your skills on a continuous basis, allowing you to develop tailored expertise quickly. You will have direct access to state-of-the-art technologies, tools and developer kits from all the major hardware and software houses, keeping you on cutting-edge of your area of expertise.  Interested? Make your move - apply online and attach a CV and a letter of application in English. We look forward to receiving your application!  If you have any questions concerning or our recruitment process, please contact finland.recruitment@accenture.com.   Accenture welcomes and encourages applications from diverse backgrounds related to gender, age, ethnicity, culture, race, religion and belief, disability, nationality, sexual orientation and gender identity. Inclusion and diversity are fundamental to our culture and core values, providing an environment where everyone brings distinct experience, talent and culture to their work. We invite you to be part of this diversity "
